<?xml version="1.0" encoding="utf-8"?>
<DBBus xmlns:xsi="http://www.w3.org/2001/XMLSchema-instance" xsi:noNamespaceSchemaLocation="trans/DBBus.xsd" DataGroupId="jbrx">
	
	<DataServiceEngine>com.gavin.plugin.database.BigDataEngine</DataServiceEngine>
	<!-- mysql连接的依赖包是高版本的情况下 -->
	<!-- jdbc:mysql://readUser.www.mysql:8084/www?Unicode=true&amp;characterEncoding=utf8 -->
	<DataGroup Id="readUser" ClassPath="com.gavin.plugin.database.DataEngine" Driver="com.cj.mysql.jdbc.Driver">
		<Database URI="jdbc:mysql://read.www.rxgj.mysql:3306/jbrx?useUnicode=true&amp;characterEncoding=utf8&amp;useJDBCCompliantTimezoneShift=true&amp;useLegacyDatetimeCode=false&amp;serverTimezone=Hongkong&amp;useSSL=false" LoadLevel="100" KeyIV="DECSECURITYKEYABCDEFG|EiJPWIgQQDgoJXlRy91SZncpdZgwQEHi">
			<User UserName="root" Password="123456"/>
			<ConnectionPool>
				<MinConnectionCount>1</MinConnectionCount>
				<MaxConnectionCount>5</MaxConnectionCount>
			</ConnectionPool>
		</Database>
	</DataGroup>
	
	<DataGroup Id="writeUser" ClassPath="com.gavin.plugin.database.DataEngine" Driver="com.cj.mysql.jdbc.Driver">
		<Database URI="jdbc:mysql://write.www.rxgj.mysql:3306/jbrx?useUnicode=true&amp;characterEncoding=utf8&amp;useJDBCCompliantTimezoneShift=true&amp;useLegacyDatetimeCode=false&amp;serverTimezone=Hongkong&amp;useSSL=false" LoadLevel="100" KeyIV="DECSECURITYKEYABCDEFG|EiJPWIgQQDgoJXlRy91SZncpdZgwQEHi">
			<User UserName="root" Password="123456"/>
			<ConnectionPool>
				<MinConnectionCount>1</MinConnectionCount>
				<MaxConnectionCount>5</MaxConnectionCount>
			</ConnectionPool>
		</Database>
	</DataGroup>
	<Plugin Resource="trans/service/plugin.xml" Encoding="utf-8"/>
	
 </DBBus>