<?xml version="1.0" encoding="utf-8"?>
<DBBus xmlns:xsi="http://www.w3.org/2001/XMLSchema-instance" xsi:noNamespaceSchemaLocation="trans/DBBus.xsd" DataGroupId="jbrx">
	
	<DataServiceEngine>com.gavin.plugin.database.BigDataEngine</DataServiceEngine>

	<DataGroup Id="readMessage" ClassPath="com.gavin.plugin.database.DataEngine" Driver="com.mysql.jdbc.Driver">
		<Database URI="jdbc:mysql://readMessage.www.mall.mysql:3306/jbrx?useUnicode=true&amp;characterEncoding=utf8&amp;useJDBCCompliantTimezoneShift=true&amp;useLegacyDatetimeCode=false&amp;serverTimezone=Hongkong&amp;useSSL=false" LoadLevel="100" KeyIV="DECSECURITYKEYABCDEFG|EiJPWIgQQDgoJXlRy91SZncpdZgwQEHi">
			<User UserName="root" Password="root"/>
			<ConnectionPool>
				<MinConnectionCount>1</MinConnectionCount>
				<MaxConnectionCount>2</MaxConnectionCount>
			</ConnectionPool>
		</Database>
	</DataGroup>
	
	<DataGroup Id="writeMessage" ClassPath="com.gavin.plugin.database.DataEngine" Driver="com.mysql.jdbc.Driver">
		<Database URI="jdbc:mysql://writeMessage.www.mall.mysql:3306/jbrx?useUnicode=true&amp;characterEncoding=utf8&amp;useJDBCCompliantTimezoneShift=true&amp;useLegacyDatetimeCode=false&amp;serverTimezone=Hongkong&amp;useSSL=false" LoadLevel="100" KeyIV="DECSECURITYKEYABCDEFG|EiJPWIgQQDgoJXlRy91SZncpdZgwQEHi">
			<User UserName="root" Password="root"/>
			<ConnectionPool>
				<MinConnectionCount>1</MinConnectionCount>
				<MaxConnectionCount>2</MaxConnectionCount>
			</ConnectionPool>
		</Database>
	</DataGroup>

	<Plugin Resource="trans/message/plugin.xml" Encoding="utf-8"/>			
	
</DBBus>